{
  "package_mode": "bundle",
  "plugin_name": "ubm-goal-setting",
  "entry_points": {
    "skills": [
      "run-ubm-goal-setting",
      "run-ubm-knowledge-sync"
    ],
    "agents": [
      "info-collector",
      "output-formatter",
      "goal-reviewer",
      "phase3-coordinator",
      "knowledge-extractor"
    ],
    "commands": [
      "ubm-goal-setting",
      "ubm-knowledge-sync"
    ],
    "hooks": [
      "ubm-write-path-guard.py"
    ]
  },
  "distribution": {
    "distributable": false,
    "bundle_targets": [],
    "category": "productivity",
    "tags": [
      "goal-setting",
      "knowledge-sync",
      "obsidian"
    ],
    "vault_root_env": "UBM_VAULT_ROOT"
  },
  "pkg_checks": {
    "PKG-001": {
      "status": "skip",
      "last_run_at": "2026-07-05T03:40:06Z",
      "skip_reason": "official claude plugin validate strict command is environment-dependent and was not available in this local verification pass",
      "findings_count": 0
    },
    "PKG-002": {
      "status": "pass",
      "last_run_at": "2026-07-05T03:40:06Z",
      "findings_count": 0
    },
    "PKG-003": {
      "status": "pass",
      "last_run_at": "2026-07-05T03:40:06Z",
      "findings_count": 0
    },
    "PKG-004": {
      "status": "pass",
      "last_run_at": "2026-07-05T03:40:06Z",
      "findings_count": 0
    },
    "PKG-005": {
      "status": "pass",
      "last_run_at": "2026-07-05T03:40:06Z",
      "findings_count": 0
    },
    "PKG-006": {
      "status": "pass",
      "last_run_at": "2026-07-05T03:40:06Z",
      "findings_count": 0
    },
    "PKG-007": {
      "status": "pass",
      "last_run_at": "2026-07-05T03:40:06Z",
      "findings_count": 0
    },
    "PKG-008": {
      "status": "pass",
      "last_run_at": "2026-07-05T03:40:06Z",
      "findings_count": 0
    },
    "PKG-009": {
      "status": "pass",
      "last_run_at": "2026-07-05T04:17:55Z",
      "findings_count": 0
    },
    "PKG-010": {
      "status": "not_applicable",
      "last_run_at": "2026-07-05T04:17:55Z",
      "skip_reason": "distributable:false・marketplace 非掲載につき install smoke 非適用",
      "findings_count": 0
    },
    "PKG-011": {
      "status": "not_applicable",
      "last_run_at": "2026-07-05T04:17:55Z",
      "skip_reason": "distributable:false・marketplace 非掲載につき uninstall smoke 非適用",
      "findings_count": 0
    },
    "PKG-012": {
      "status": "not_applicable",
      "last_run_at": "2026-07-05T04:17:55Z",
      "skip_reason": "distributable:false・marketplace 非掲載につき upgrade 冪等性 smoke 非適用",
      "findings_count": 0
    },
    "PKG-013a": {
      "status": "pass",
      "last_run_at": "2026-07-05T04:17:55Z",
      "findings_count": 0
    },
    "PKG-013b": {
      "status": "pass",
      "last_run_at": "2026-07-05T04:17:55Z",
      "findings_count": 0
    },
    "PKG-013c": {
      "status": "pass",
      "last_run_at": "2026-07-05T04:17:55Z",
      "findings_count": 0
    },
    "PKG-013d": {
      "status": "pass",
      "last_run_at": "2026-07-05T04:17:55Z",
      "findings_count": 0
    },
    "PKG-014": {
      "status": "skip",
      "last_run_at": "2026-07-05T04:17:55Z",
      "skip_reason": "validate-plugin-package.py が pkg-014 checker 未実装(PKG-002..008 のみ対応)。runtime contract 一致は手動確認事項として backlog",
      "findings_count": 0
    },
    "PKG-015": {
      "status": "not_applicable",
      "last_run_at": "2026-07-05T04:17:55Z",
      "skip_reason": "distributable:false・個人利用で release rubric 違反ログ未蓄積",
      "findings_count": 0
    }
  }
}
